Ref,Mutations,MAbs
Baum20,417E; 444Q; 445A; 450D; 453F; 455F; 484K; 485D; 486V; 490LS; 493K,REGN-COV2; REGN10933; REGN10934; REGN10987; REGN10989; REGN10989/10934; REGN10989/10987
Greaney20,378N; 417E; 420R; 484V; 486A; 487R; 490K,COV2-2082; COV2-2165; COV2-2479; COV2-2832
Li20h,234Q; 435S; 439K; 452R; 472V; 475V; 483A; 490L; 508H; 831V,157; 247; 261-262; AB35; B38; CA1; CB6; H00S022; H014; H4; P2B-2F6; P2C-1F11; X593
Liu20e,455R; 475R; 502R,1-20; 2-15; 2-4; 4-20
Liu20h,345ANS; 346G; 352D; 378EQ; 408K; 441R; 444ENR; 445G; 446DV; 450DKY; 452R; 458Q; 474P; 476DS; 477GINR; 478IP; 479LS; 483FG; 484ADGK; 486LSVY; 490LS; 494P; 499L; 504D; 514F; 517R,1B07; 2B04; 2H04; SARS2-01; SARS2-02; SARS2-07; SARS2-16; SARS2-19; SARS2-21; SARS2-22; SARS2-23; SARS2-31; SARS2-32; SARS2-34; SARS2-55; SARS2-58; SARS2-66; SARS2-71
Starr20b,406W; 417N; 439K; 440D; 444Q; 460T; 475V; 486IK; 493K,LY-CoV2016; REGN-COV2; REGN10933; REGN10987
Tortorici20,449N; 455F; 484KQ; 490LS; 494P,S2M11
Weisblum20,346KS; 439K; 440K; 444NQT; 445EGIL; 446V; 455FR; 456V; 483A; 484ADKQ; 490LS; 493KLR; 494P,C121; C135; C144
